text,binary_label,multiclass_label
vi one ur nicknam lmao first repli thing,cyberbullying,ethnicity
woman call black man nigger front kid women right live societi disgust,cyberbullying,ethnicity
look like baghdadi carbon copi moham without propheci islam,cyberbullying,religion
first know press lie second protest fine looter vandal arrest ass kick id guess ur one defund polic im get crimin stop first sit,cyberbullying,ethnicity
heck dude ur idea top notch right love first one especi,cyberbullying,ethnicity
rt im sexist feel like level clear refer men call,cyberbullying,gender
girl high school constant belittl person bulli sorri got caught end hurt mani peopl one like trust tender kind strength,cyberbullying,age
dumb nigger call us scumbag fuck bitch,cyberbullying,ethnicity
islam chariti pakistan fund us direct link muslim terrorist group mean us fund encourag muslim terrorist group pakistan bad us help pakistan dollarsnow pakistan use dollar boost islam terrorismpak fool us,cyberbullying,religion
peopl survey year artist nari ward work imposs see retrospect latest incarn anyth filter past six week black live matter movement swept countri,cyberbullying,ethnicity
mr terribl trump youd told mani time overfrom ur one worst presidentsid ever known ur lack respect urself first ladymr melania trump attend late congressman john lewi funer resign immedi,cyberbullying,ethnicity
miley cyrus make date rape joke onstag gay guardian,cyberbullying,gender
podcast speak danger expert author millitari grandmoth experi talk bulli school onlin give action step parent use help kid deal bulli,cyberbullying,age
mad shit dickhead rt fuck obama dumb ass nigger,cyberbullying,ethnicity
nohat pleas sweet amaz cool talent even said cool pleas stop like bulli,cyberbullying,other_cyberbullying
yes gay men grope women definit thing requir deeper convers rape cultur male gaze much doesnt mean aw cis straight men write joke,cyberbullying,gender
see two heartwarm tale children join abi girl born one eye navig school home life confront prejudic bulli one day blind abandon kitten give strength face bulli shes see two,cyberbullying,age
wild girl bulli high school think might actual buy pyramid scheme makeup today,cyberbullying,age
tri give man pass fine attack first that dumb fuck cant call nigger,cyberbullying,ethnicity
best friend monkey look nigger shut fuck dumb cunt,cyberbullying,ethnicity
ur right second first one kalagulabi ladkiyaan,cyberbullying,ethnicity
what iron thing youv seen happen girl bulli high school lesbian talk much love rupaul drag race nfjdjfjdjfj,cyberbullying,age
heard terrorist attack peshawartaliban follow jihaddo quran mention kill common peopl badlyrip human,cyberbullying,religion
rt im sexist women men differ cant im say men superior yeehh,cyberbullying,gender
non duo dumb fuck nigger kind shit,cyberbullying,ethnicity
show human jihadi terrorist let come kill thus enabl win jihad help go heaven get virgin,cyberbullying,religion
rt que fuck es reason lpm carajo,cyberbullying,other_cyberbullying
queen yes devout christian woman believ strong divin right monarch peopl believ chosen god eh know anyon els whod think categori nigel,cyberbullying,religion
tweet reli associ hijab radic islam suggest someon wear hijab cant support american valu promot idea white christian one trust hope understand that harm racist,cyberbullying,religion
idiot ch recit day pleas translat post everi vers recit supremacist tri say fellow muslim hindus jew sikh jain buddhist equal muslim muslim must restor plus hindutempl destroy islam,cyberbullying,religion
im even muslim idiot,cyberbullying,religion
could never choos islam given noth caliph dictatorship year,cyberbullying,religion
bad desper realiz muslim ban joe think better rethink polici propos moment sound like idiot,cyberbullying,religion
anoth race bait idiot brown men would hate hinduism buddhism tao hate islam,cyberbullying,religion
new follow id like throw disclaim dont support fat shame gay hate tran joke rape joke sexual assault joke your someon doesnt care word offend group peopl pleas unfollow advanc,cyberbullying,gender
classmat autist becam stress depress told parent dont wanna continu studi also made fear continu school student gonna bulli death autist,cyberbullying,age
got damn anoth ignor bitch gt hate ass fucka fuck obama dumb ass niggerdumb motherfuck,cyberbullying,ethnicity
deserv back your engag harass peopl night bet youv kind shout twitter your exact school bulli mental health advoc type,cyberbullying,age
fuck obama stupid fuck nigger mad dumb bitch presid black,cyberbullying,ethnicity
last night dream partner subscrib onlyfan girl bulli high school,cyberbullying,age
two good book document deprav islam,cyberbullying,religion
tell terrorist chop head bomb fight innoc arent muslim ask read quran ever went isiss page ask read quran offici disown goon question simpl,cyberbullying,religion
want everyth return normal might problem consid chris sabat secret habit produc rape gay joke use toei ip properti mayb knife collegu back make joke jellybean suggest,cyberbullying,gender
keep lose follow fuck dumb nigger,cyberbullying,ethnicity
dont western media outlet report crime could radic leftist want fool christian conserv support whitewash islam jihadist terrorist profit regim chang christian support,cyberbullying,religion
read last line idiot list muslim quranwritten muslim post origin guy interpret anyth make fool public follow guy say dont beliv democraci,cyberbullying,religion
gay joke rape joke sexist joke retard joke pretti much kind inconsider humor super distast,cyberbullying,gender
middl school bulli post insta pic hes ugli amount joy feel rn,cyberbullying,age
rt dont care peopl call sexist dont find femal comedian funni,cyberbullying,gender
nigger act like player realli dumb fuck,cyberbullying,ethnicity
one daili drama think gonna run episod without spoil anyth main stori high school girl get bulli school everyday amp make pact boy meet onlin commit suici togeth,cyberbullying,age
happen right dont say someth idiot rest moron hollywood right second muslim kidnap sell black men women slaveri,cyberbullying,religion
rt sexist femal footbal comment dont work cant take serious netbal mayb,cyberbullying,gender
understand say way regard gods defend islam terror read gods said court gandhijiwhi murder first read tell psychic patient,cyberbullying,religion
almost decad ago would watch guy video everi morn school guy pivot voic middl high school colleg young christian woman ministri your right heart sad alway love,cyberbullying,religion
im radic hindu like brainwash muslim hindusim live life way want idiot blind follow sacr book start terror name pf god,cyberbullying,religion
hahah saw snap stori shes real bad bitch,cyberbullying,other_cyberbullying
lost call black men nigger lot disgust shit said,cyberbullying,ethnicity
realli look refurbish muslim carpent firemen doctor desert dweller hiker amp know els wear fabric front face hour end amp think oh im sudden go pass idiot,cyberbullying,religion
fuck obama dumb ass nigger damnnn racist peopl go,cyberbullying,ethnicity
first dumb ugli nigger name wayn posit trash soft ass nigga fuck black trash white amp orang pictwittercomzbvqnbazo,cyberbullying,ethnicity
typic redneck dumb fuck richard sherman aint noth typic nigger,cyberbullying,ethnicity
wit similar scene high school bulli guy got fight girl like one video luckili wasnt strip cloth girl went tight grip jewel tighten everi blow guy cant forget day,cyberbullying,age
fuck dumb bitch youll never see nigger feel,cyberbullying,ethnicity
fulani jihad terrorist nigerian armi mission see god vengeanc aris mighti sword put end atroc god human,cyberbullying,religion
hope die fuck bitch ass faggit ur rhyme trash dumb ass fucker fuck drop dead bitch nigger,cyberbullying,ethnicity
kid get religi freedom kill birth though mayb spend life christian bear mark jew parent religi freedom stop harm other reason dont support radic islamist,cyberbullying,religion
look like jussi smollett stori true im sick black amp gay still worri walk street white men call faggot nigger put rope around neck pour bleach amp yell maga countri disgust,cyberbullying,ethnicity
fat joke like rape joke gay joke black joke etc alway funni teller never stop,cyberbullying,gender
isi actual islam caliph concept islam isi follow bagdadi terrorist world hero world mani spoke isi clear quran amp activ given terrorist,cyberbullying,religion
suppos kat think unfair like everi time yuck food given bad critiquesh like child stop bitch mkr,cyberbullying,gender
grew life right went privat school grew amaz privileg wonder kind person bulli bulli person,cyberbullying,age
harass one see violat tos tri organ block campaign see,cyberbullying,gender
luca dont let bulli win move school load support,cyberbullying,age
even call redempt said sorri everyon forgav like school yard bulli,cyberbullying,age
yall mf aggi man alway compar cc yall shitti ass school leav us tf alon aint say sht yall,cyberbullying,age
sorri name use derogatori manner weve call ni gger centuri creat law white women could get away kill child slave karen aint shit compar call ignor skin color negro,cyberbullying,ethnicity
rt overwatch review blizzard doesnt announc game announc univers,cyberbullying,other_cyberbullying
sound littl like latter complain defend bulli make go school probabl start own lib video watch video samesimilar peopl,cyberbullying,age
your dumb af peopl flat nigger dont burn flag especi american flag go fuck,cyberbullying,ethnicity
although infidel islamist call us also patriot right critiqu islam terrorist group isi infidel unpatriot critiqu us compar isi islam liber knew know refus believ quran,cyberbullying,religion
high school girl get bulli never met girl girl went far write thing like whore front sink school restroom grab sharpi chang whore great person hope good,cyberbullying,age
girl bulli high school marri dude like,cyberbullying,age
seri rerev arcadia high anarchist seri author max henri genr high school bulli romanc preorder done deal avail book seri avail,cyberbullying,age
tell arab muslim monster,cyberbullying,religion
that pretti much gist ive learn anyth past coupl year good republican peopl learn error way chang that great time dont peopl fuck,cyberbullying,ethnicity
box hug whenev need rt fuck obama dumb ass nigger,cyberbullying,ethnicity
friend yesterday told brave accept friend request facebook girl bulli high school answer im matur move girl seem differ person honest im glad shes live redempt arc,cyberbullying,age
iron fight gun reform also need loyal foot soldier appeal thousand white evangel radic traditionalist cathol christian extremist support gun control easi paint member group singl colour,cyberbullying,religion
your lucki american among mani perk mean complain whatev want whenev want fact black black crime say noth abort black babi kill black peopl anyth must slip past,cyberbullying,ethnicity
educ link terror bin laden engin alzawahari also educ mindset sinc morn havent answer one question ask rather blame fund islam terror crap shove convent degre,cyberbullying,religion
fuck obama dumb ass nigger hate racist fat bitch like fat fuck ignor smfh,cyberbullying,ethnicity
rt fuck obama dumb ass nigger lt look word stupid,cyberbullying,ethnicity
lmfao lmfao care women ufc titl match sexist serious one care lol,cyberbullying,gender
girl bulli high school juic im ladybug,cyberbullying,age
jayap didnt school anyon threw childish temper tantrum child probabl schoolyard bulli,cyberbullying,age
lmao love scene funni mom first kdrama goe ur crazi one,cyberbullying,ethnicity
didyouknow amp sponsor anti gay blog modern male make rape joke shut,cyberbullying,gender
hope yall bulli jiyaad back way bulli yall primari school,cyberbullying,age
oh cancel ur subcript spotifi first rajin tri spotifi support els creat new one,cyberbullying,ethnicity
christian support bjp islam radic real threat india stay secular countri hindu major islam major wont secular radic islamist must dealt iron fist,cyberbullying,religion
notic muslim want sharia sharia say apost must kill support direct,cyberbullying,religion
first crusad muslim microbrain year european head direct,cyberbullying,religion
rt im sexist need clean ladi either pay someon buy prescrib med back pain wi,cyberbullying,gender
there woman write women tech book shes stomp everyon path long get money,cyberbullying,other_cyberbullying
first dont know bulli come lie much cant believ noth say second problem chi new problem year meddler dont give damn children school wouldnt poor,cyberbullying,age
chickfila go stop donat christian group tortur human gop way give radic left moral chickfila ok keep donat organ tortur human thank support,cyberbullying,religion
bitch period sync mine call alpha femal,cyberbullying,gender
fuck kobe idgaf dumb sportsbal nigger,cyberbullying,ethnicity
thank prove point anti jewish state tow anti muslim state un state non un recogn artsakh come your idiot,cyberbullying,religion
still notificationstldm column account remov dude particular decid leav enough,cyberbullying,other_cyberbullying
fuck ty moe lls lol nigger aint shit dumb bitch,cyberbullying,ethnicity
rt look ive talk men femin rape cultur mayb start blame us speak,cyberbullying,other_cyberbullying
dude blacker midnight talk think nigger dumb like ur ugli dumb fuck ima delet ur ass,cyberbullying,ethnicity
convent bore male lead encount gay charact excus cheap unfunni rape joke persona,cyberbullying,gender
funni relationship moviei saw theater came exact wrong target audienc bc freshman high school liter bulli mean girl daili year later appreci meant,cyberbullying,age
cannot stop watch blame,cyberbullying,other_cyberbullying
nigger realli dumb ugli ass bitch somebodi gonna fuck,cyberbullying,ethnicity
remind bulli conley joke odd kid school bag get push door spend rest day stumbl forward arm behind,cyberbullying,age
isi never attack muslim like ezidi kill non believ,cyberbullying,religion
high school bulli,cyberbullying,age
rememb back high school use bulli lot voic voic still deeper compar girl school thus began tirad actual male result manifest great dislik voic,cyberbullying,age
look like everi girl bulli high school,cyberbullying,age
ubisoft quebec bad scene like bulli middl school except bulli middl school dont wield hr depart like club nail,cyberbullying,age
probabl obuma refus acknowledg islam terror probabl think killari clinton great person obuma endors back,cyberbullying,religion
hey girl know havent spoken sinc bulli high school lol girlboss join team send one time fee minut ur phone get ur yasssss queen starter pack love talk soon,cyberbullying,age
reason overal number increas muslim breed like rat like prophet told islam,cyberbullying,religion
idiot outta touch dont even mind allahand dont expect everyon muslim fact know higher yet nigga still walk around kinda nut shxt like ya clock aint gon ever stop amp aint go god,cyberbullying,religion
here big lesson learn right begin quiet voic world read precious word god find matur christian woman mentor fall ever love jesus worthi,cyberbullying,religion
analog idiot read fuckin mean think muslim foreign hindus nativ ideolog hitler jew foreign aryan nativ analog kind dude need page theori understand word theori,cyberbullying,religion
fuck green old shit fuck im tire wanna sleep dumb green nigger,cyberbullying,ethnicity
disput caus lil bitch go fuck self nigger fuck aw caus lose dumb detriment,cyberbullying,ethnicity
excus moham use rob murder state genocid intent,cyberbullying,religion
mention fake gay cool peopl year ago talk fa tell prison rape joke,cyberbullying,gender
burhan wani becam terrorist read quran isi follow quran,cyberbullying,religion
never realis much brainless idiot realli never said word emili jone behead black woman play park muslim rape gang alllivesmatt support riot resign,cyberbullying,religion
fact let girl like middl school bulli,cyberbullying,age
anyth fair game outsid rape joke gay joke guess,cyberbullying,gender
uk also becom muslim countri next decad continu prase appeas idiot david mani also india,cyberbullying,religion
rt im complet sexist butthor dude,cyberbullying,gender
wanna say real quick love see tweet nessa simultan look like everi girl bulli middl school half girl friend senior year high school say shes great,cyberbullying,age
peopl around havent hit puberti yet arent tall enough bulli plus im still middl school ill probabl get pick high school tho,cyberbullying,age
elimin dont show merci terrorist terror danger undoubt dt terror pour wth religi fundament danger human elimin nthng wrng bcz de believ jihad path death wl provid heaven dem,cyberbullying,religion
your classi gay rape joke especi today,cyberbullying,gender
deserv appreci ur ppl inde indian show gut courag feb real surgic strike one like use see bollywood congrat first time india attack aggress without trace cowardic,cyberbullying,ethnicity
rt stage islam demograph jihad tcot gt,cyberbullying,religion
dont care think im idiot state show muslim hold extremist view call repres omar antisemit said nword deni would like dig video,cyberbullying,religion
your super hurt piss comedian make joke kobe bryant death get pleas though rememb dismiss peopl upset comic shit tran peopl gay peopl tell rape joke,cyberbullying,gender
went school girl popular crowd middl school high school went freshman year idgaf peopl make fun wouldv bulli heartbeat wasnt invis school go,cyberbullying,age
legit scream lung fuck hate,cyberbullying,other_cyberbullying
rt jealous caus inferior joke,cyberbullying,gender
jus jus like dumb nigger ape readi fuck white girl leav th mom whore,cyberbullying,ethnicity
rt assumpt islam anoth religion alreadi fool lot pplislam war ampworld domin,cyberbullying,religion
one time girl went high school cyber bulli bc excit tri sushi first time like use love japan blah blah blah anyway guess work bc still rememb red head gotta mean,cyberbullying,age
rt respons isnt level introspect sexist protest,cyberbullying,gender
pls curs corona virus islam terror seem supernatur power,cyberbullying,religion
yes call femal dog bitch woman,cyberbullying,gender
even kid show prison rape joke seen accept seen funni fuck disgust trivialis rape demonis gay peopl rapist fuck predat shut fuck fuck soap,cyberbullying,gender
know nigga lookin know gon hate,cyberbullying,ethnicity
even girl bulli back day high school tweet bout,cyberbullying,age
muslim first crusad attack christian world centuri attack back,cyberbullying,religion
think thing back call black dog word ss peopl realli awar connot anyth past pure ignor,cyberbullying,ethnicity
yeah love fri chicken dont ya ya dumb fuck nigger minut later oh yeah fuck destroy ass fuck,cyberbullying,ethnicity
wild time androgyn young girl forc super feminin tell spoke unnatur high pitch voic coupl year bulli didnt get bulli anymor sure sound wors,cyberbullying,age
know muslim call peopl like use idiot tri justifi slaveri thay dont hope energi tell black peopl dont get mad white man arab slave,cyberbullying,religion
yurustar one like arusan amp temma talk abt game load screen appear mi oo load screen wha first stage clear load screen miyabi ur gonna talk abt load screen proceed teas abt,cyberbullying,ethnicity
learn peopl idiot western world fam member die question god muslim know religion thought better placew belong allah shall return doesnt mean doesnt love dad,cyberbullying,religion
thug islam muslim persecut christian centuri cant blame us act racism dont middl class white idiot excus start troubl bring forc remov arrest,cyberbullying,religion
nigger dumb enough come mention dms fuck ass music insta block expos yo beggin ass,cyberbullying,ethnicity
superhero destroy entir citi street apprehend one crimin push one old ladi everyon fuck yeah justic alway come first left pull statu peopl enslav kill actual peopl everyon omg stop ur gonna dent,cyberbullying,ethnicity
deriv mean miss,cyberbullying,other_cyberbullying
jewish men muslim men male british royal famili jewish men feel need concentr idiot,cyberbullying,religion
done recommend involv kid two differ school good plan believ dont sheep lina bulli,cyberbullying,age
jack morph one high school bulli,cyberbullying,age
quetta ind mai attack ho jihad pak mai ho human kai dhusman doubl standard nahi chalaga terrorist terrorist,cyberbullying,religion
sadden famili hide child molest disown child theyr gay rape commentari joke child support war,cyberbullying,gender
hate bulli sister let us make peac agreement peopl jesus dont hate juda five fool virgin school teacher didnt say ever repent heard die prison,cyberbullying,age
assum ms conway readi fulfil duti christian woman right wing ideologu shut mouth get pregnant stay home cook georg,cyberbullying,religion
eve liter moment away complet possess hot manipul bulli school mia mom walk room disrupt ritual second complet ohhh bad loser could im gonna bulli,cyberbullying,age
trent zimmerman crack gay rape joke qt,cyberbullying,gender
nigga sens humor revolv around rape joke fake gay,cyberbullying,gender
right wing pro life christian woman disgust assum wouldnt ive seen call despic injustic,cyberbullying,religion
sound like school bulli invit littl guy bulli punch littl guy thw face prove bulli bulli,cyberbullying,age
woman wear bikini wear cover everyth choic make choic islam beaten,cyberbullying,religion
mean salti odvii nigger dumb fuck,cyberbullying,ethnicity
cant make gay joke say gay peopl caus child rape interchang hes progress way intellectu design public school proscienc,cyberbullying,gender
dad die white girl middlehigh school wanna nice sudden bulli aint forget,cyberbullying,age
dont care bulli probabl bulli school get paid bulli everyon children,cyberbullying,age
vote republican your dumb ass nigger rt fuck obama yea im black nigger burn,cyberbullying,ethnicity
yet liber teacher receiv good portion govern spent fund instal virus defeat technolog system yes exist school environ would total steril teacher would excus amp wed save,cyberbullying,age
foolish hindus buddhist christian support radic muslim name secular support caa nrc ucc ur jesus support stone women,cyberbullying,religion
white male congress call femal poc colleagu fuck bitch camera face repercuss would expect white male congress vote serious chang system whiteprivileg grassroot chang need,cyberbullying,gender
yo say twitter real nigga face bitch rt fuck obama dumb ass nigger,cyberbullying,ethnicity
left becom real threaten danger britain recoveri free sovereign trade nation incred left use muslim black peopl destroy britain muslim black peopl persuad saw branch idiot,cyberbullying,religion
rt fuck get red wtrwwaw,cyberbullying,other_cyberbullying
get put islam bullshit bingo card,cyberbullying,religion
pleas distract work tell first time heard sonic youth nissan rogu drive high school immedi want kim gordon bulli,cyberbullying,age
muslim courag say isi terrorist group kind inform iranian muslim also fought isi quran teach islam teach chant allah akbar kill someon total unaccept,cyberbullying,religion
actual choos ugli bitch ass must fat,cyberbullying,gender
im even exagger girl bulli high school singl mum crack head welfar queen gangaffili lost custodi kid prison live home parent still person drama social media caught camera steal whew lol,cyberbullying,age
yes im black girl yes cant braid anyth past dooki braid yes exist,cyberbullying,ethnicity
love call news realiti hes high school shitbag bulli peopl other dirti laundri sit unapologet worst part found way monet hes support littl shit like,cyberbullying,age
card fan rt noth disgust black uk fan cheer along side million folk consid nigger lmao,cyberbullying,ethnicity
stupid fuck aftermath dumb nigger,cyberbullying,ethnicity
one christ terror group longer exist scum like use ration mus terror group,cyberbullying,religion
anyth els white privileg inher racism believ respons past differ judgement skin tone reason black black crime alway brought retort blm show whiteblack curious,cyberbullying,ethnicity
public humili child isnt send militari school act end day child parent respons take care child mental physic welfar daddi bulli,cyberbullying,age
expect wear keffiyah cultur appropri islam terror,cyberbullying,religion
make follow joke unfollow suicid depress gay rape racist cancer,cyberbullying,gender
nta feel bad famili yep sure will malici deliber terror someon im guess bulli school alway got dont sens humor didnt mean way overreact,cyberbullying,age
fuck nigger cunt bitch ass shit damn piss stupid dumb idiot takethat,cyberbullying,ethnicity
loui bulli sinc bulli gay guy school gay fan take unfortun,cyberbullying,age
french comic make joke gay rape gay part funni rape maladroit canteloup europ,cyberbullying,gender
ngl greatest decis join twitter bulli outsid school,cyberbullying,age
transphob bulli learn afraid chill honey hes school shooter,cyberbullying,age
lol caus bulli want beat everi one ass rich talkn blowin stuff talkin punch sumon lol,cyberbullying,other_cyberbullying
sure happi nonmuslim countri franc greec russia etc idiot admin listen decad ottoman mean muslim,cyberbullying,religion
girl bulli lesbian high school tinder,cyberbullying,age
emo skater bf jisung go home patch fight bulli school,cyberbullying,age
fuckkkkk dumb ass nigger fuck,cyberbullying,ethnicity
daughter bulli jump school two girl jr high school school noth let say took matter hand take girl ghetto cant take ghetto girl stop,cyberbullying,age
peopl bodi shame peopl made rape joke even joke said want someon straight give stis could get sick die made death threat toward call white gay,cyberbullying,gender
talk radic islam terror talk ur minor popul decreas prcnt girl child hindu burn aliv balochistan india go becam superpow pakistan blacklist wrld orgnzsn,cyberbullying,religion
white nigger dumb fuck term noth race,cyberbullying,ethnicity
