text,binary_label,multiclass_label
million valid argument doesnt chang realiti,cyberbullying,other_cyberbullying
simon pull im christian woman card like maam aint right card use,cyberbullying,religion
fuck nigger fuck dumb bitch,cyberbullying,ethnicity
girl came work said oh god think one bulli high school,cyberbullying,age
actual direct relat tiktok girl type girl kind wish bulli better high school mean want bulli girl one tiktok opinion,cyberbullying,age
stupid ass dumb fuck nigger funni,cyberbullying,ethnicity
boop go cri fed ouchi water bottl hurt ballist helmet plate carrier like everi bulli school theyr fuck babi ive seen less dramat reaction soccer,cyberbullying,age
yeah sorri daddi cant pay next boob job fake tan session rt fuck obama dumb ass nigger pictwittercomisjynvp,cyberbullying,ethnicity
get hard featurelength prison rape joke minut gay panic ugli stuff funni dont bother movi,cyberbullying,gender
deserv applaus ive bulli victim school year bulli bare got punish instead got punish stand,cyberbullying,age
girl bulli high school call empath,cyberbullying,age
one girl friend group use bulli one friend back high school much reconnect adult theyr bffs match tattoo girl could never befriend someon bulli bad must anoth level matur,cyberbullying,age
kill nigger kkk hold bitch kill yo self fuck wrong ya dumb bitch,cyberbullying,ethnicity
watch white girl youtub get lip inject black ass like got bulli peopl high school racist onlin natur lip human experi uniqu lmao,cyberbullying,age
quinn queer quinn queef nicknam bulli sinc middl school brother start nicknam,cyberbullying,age
sum sick dumb ass nigger fuck bed mad cuz gotta lay better go suck,cyberbullying,ethnicity
vacuous word ill inform idiot dont far left loon put much focus china imprison uyghur muslim way hyper focus israel say anti semit dont deserv mp let alon shadow cabinet,cyberbullying,religion
alum want give back univers feel like peopl wont reprimand gross neglig felt comfort say dumb nigger uncomfort say fuck understand peopl outrag call resign,cyberbullying,ethnicity
equal right special right forgotten even white christian woman couldnt vote year ago,cyberbullying,religion
rt women pakistan christian hindu minor particular vulner forc marriag muslim men,cyberbullying,religion
dont care kramer think im dumb nigger seinfield still funni fuck thatisal,cyberbullying,ethnicity
way gay rape joke longer accept chang brand,cyberbullying,gender
wonder got hug often enough children im most faceti secur peopl dont use word like feminazi,cyberbullying,other_cyberbullying
personnel usdoj washington dc nigger matter skin color dumb fuck nigger,cyberbullying,ethnicity
bulli like kid need friend didnt know els get attent bulli girl bulli fanci aaaand bull high school long hair skinni spot glass gay,cyberbullying,age
yet didnt rape woman fork threaten joke bad bad actual rape also gay man tri molest defend someon sexual abus someon dont like wrong,cyberbullying,gender
whos laugh great song word describ alway get bulli skool like follow tweet,cyberbullying,other_cyberbullying
someon dont think tri hurt said daughter school person overheard within week nasti littl cliqu christen daughter myra dread experi reinforc dislik bulli,cyberbullying,age
believ jahuriyat kahmiri brotherssist back isi pakistanarmi wage jihad jus terrorist jihadist hav human left dat terrorstatepakistan shud wipe balochistan shud free need finalstrik,cyberbullying,religion
poor babi islmacist attack uk last year idiot main reason peopl conserv muslim faith kill non believ kill within middl east north africa call normal,cyberbullying,religion
ask regret done condemn islam terrorist use children shake jihad human,cyberbullying,religion
stop hate dumb nigger fuck yall judg other getalif,cyberbullying,ethnicity
least major us know guy behind ac london salafi tbh need fear allah get life state muslim sigh less month check mani idiot hes accumul follow,cyberbullying,religion
love presid trump dont understand let idiot name tear histori hes presid stop shit power charg countri quit let happen true counti sold muslim that obumm,cyberbullying,religion
girl vaush stream one talk black nation vaush pretti much bulli stream want known simpli dude antagon wors context,cyberbullying,age
christian audac know stupid sound tell im beauti muslim name yall right thing disgust chang name someth els idiot tell god dont like name,cyberbullying,religion
rt girl doesnt run fast boy likeagirl focus like get pregnant glorifi motherhood,cyberbullying,gender
gay rape joke straight guy offend,cyberbullying,gender
also spot,cyberbullying,other_cyberbullying
realli want tell stori would peopl mil follow unwit caus abus mob,cyberbullying,other_cyberbullying
joey tweet joke child rape rape general use word gimmick base wrestl fan think gay funni,cyberbullying,gender
fact ad ji gandhi tell respect commit indian christian muslim sacrif lot communiti kept kind massacr also made british administr look like idiot front whole world,cyberbullying,religion
guy realli told son stick nigger beater fuck shit dumb ass peopl wish beat,cyberbullying,ethnicity
fuck obama dumb ass nigger mad funki ass pussi stinch,cyberbullying,ethnicity
idiot call polic kamraforsometh,cyberbullying,other_cyberbullying
fuck obama dumb ass niggerstfu mad bro lol lt jit maddh lmao,cyberbullying,ethnicity
thing bad younger got bulli much disabilit dont want thing happen brother,cyberbullying,age
one foh manag done like girl bulli high school weird red blond dye job,cyberbullying,age
fuck obama dumb ass nigger smh rude ignor,cyberbullying,ethnicity
franki peach help rubi new girl school find courag stand bulli pancak girl inspir stori show small act kind make big differ someon life kidlit,cyberbullying,age
rt neger nigger exact dumb fuck dont justifi racist remark,cyberbullying,ethnicity
african american actual pretti recent shit african american classifi negro paper longest afro american nicer way say negro amp establish second class racial group white american arent call european american,cyberbullying,ethnicity
stfu rt lol chaunase brittan dumb nigger fuck,cyberbullying,ethnicity
like first bulli high school second hair still dri fuck get messeng hey girl,cyberbullying,age
exact white friend call nigganiggernegro high school post blm trend smh energi year ago,cyberbullying,ethnicity
white teenag call negro nword,cyberbullying,ethnicity
stay gettin call fuck dumb nigger crusti field slave ariell fuck still friend ouch,cyberbullying,ethnicity
oh homophob joke funni gay sex funni oh let make joke priest rape littl boy hilari ha ha ha homophobia cant make joke femin though isnt funni,cyberbullying,gender
alway black tool even school coz bulli aint bulletproof,cyberbullying,age
edibl arrang peopl call women femal also prefer term bitch,cyberbullying,gender
everi terrorist isi read quran everi jihadi read quran terrorist read quran terrorist read quran terrorist read quran terrorist kshmir read quran question quran reader becom terrorist,cyberbullying,religion
first impress interest name nicknam head tepi close rate like yes gccgc moot ever crush post sure one random thought gogi look quit cute ur pfp,cyberbullying,ethnicity
type guy bulli someon school android,cyberbullying,age
ive seen liber get mad critic mock trump putin make gay coupl make prison rape joke peopl work trump,cyberbullying,gender
care repli hes neither man woman hindu muslim intellig idiot,cyberbullying,religion
next septemb art class togeth move elementari school high school amp rememb move away work piec show emot famili bulli never saw finish piec ive wonder sinc,cyberbullying,age
rape joke still funni gay joke still funni racist joke still funni,cyberbullying,gender
dumb ass blind love fuck aint cool shit move fuck find stripper club nigger burn ur bank account thx,cyberbullying,ethnicity
nasti gay rape littl boy smart abus jokeyou need job soulu evil,cyberbullying,gender
word girl maga household treat like shitt boy bulli insecur dad like diaper jr,cyberbullying,age
tran joke gay joke fat joke disabl joke rape joke attack appear orient bodi etc harm peopl fuck origin target coulter ideolog golgotha shit monster attack,cyberbullying,gender
lurk fuck arent nigger pleas dont speak ghetto dumb bitch,cyberbullying,ethnicity
like im watch femal streamer play sea thiev dude random call bitchlik liter said anyth deserv say get much doesnt care anymor,cyberbullying,gender
haha im kinda proud royc stand cuh felt like alway tri bulli,cyberbullying,other_cyberbullying
fuck faggot fuck boy yall nigga joke rape slander women gaysgotta die,cyberbullying,gender
fuck dumb nigger,cyberbullying,ethnicity
ok anyon nigger dumb fuck,cyberbullying,ethnicity
variant ism make abus ok stand statement,cyberbullying,other_cyberbullying
super surpris know muslim islam radic countri includ orthodox radic christian support palestin,cyberbullying,religion
mani moron like hindus muslim twitterfacebook handl claim ghar wapasi aap jais idiot apn aap ko dhola de rahe ho ghanta koi farak nahi padta ms ko chutiyapa se,cyberbullying,religion
fuck bg label dumb nigger,cyberbullying,ethnicity
havent read newer stuff sinc hard transit kindl im go,cyberbullying,other_cyberbullying
bsds move away includ gpled packag base long time appl tend use amp reflect bsd chang,cyberbullying,other_cyberbullying
carol ok femal friend call bitch yourmal friend,cyberbullying,gender
play tf one person keep call everyth gay faggotri anoth keep make rape joke stay classi,cyberbullying,gender
yeap much bandwidth self genocid jew blumenth turn center attent,cyberbullying,religion
shit scare white peopl make gay joke assrap joke make uncomfort think theyr hide someth though,cyberbullying,gender
idk man klaus great step like junki gay cant happi end relationship anyon show buri gay subplot make prison rape joke best,cyberbullying,gender
shoot atfirstidiotther mani thing polic learn manag agress ampsecond vp facist wage war agaisnt countri like agaisnt muslim iraq sift blame trumpthsi man hypocrit wors trump,cyberbullying,religion
mother aunt vote stop muslim peopl brown face european absolut idiot told vote didnt expect leav win poll know button vote leav camp push tori pander,cyberbullying,religion
cancel twitter account love someon say someth good whini grade school bulli cri anyon stand,cyberbullying,age
like video feminazi fail,cyberbullying,gender
rt like im sexist feminist sometim stupid women make mistak perfect nobodi,cyberbullying,gender
tall girl year high school mock lot nicknam big bird hard enough teenag girl tall girl often look bit freakish bulli see women fail understand annoy,cyberbullying,age
rt bitch want act like nigga bad shit aint cuteeee nigga act like bitch,cyberbullying,ethnicity
went huge ordeal middlehigh school bulli like childish thing forc stop like im late girl im gonna buy plushi play game read comic one gonna stop,cyberbullying,age
opposit happen middl school well turn decad got interest convert im still deni asshol right right jewish could bulli,cyberbullying,age
peopl mean comment maker friend think think pretend migh weird hell friend someon dont like mf block act like high school bulli th,cyberbullying,age
third claim read better jehad someth call agnotolog scienc cia use take crop vers quran without full interpert enabl creat polit terrorist group al qaidah isi etc,cyberbullying,religion
girl bulli high school conserv im vagina,cyberbullying,age
believ mean girl app serv bulli pick high school yall sure take trauma peopl seek help friend,cyberbullying,age
nigger chelsea dumb fuck doesnt like pupusa probabl eat grill chees day smh,cyberbullying,ethnicity
miley cyrus make date rape joke onstag london gay real talk,cyberbullying,gender
black christian woman destroy blm narrat nyc via bevelin right track refund polic,cyberbullying,religion
kid area think amus make rape joke tell peopl kill label anyth gay dont like theyr like ten,cyberbullying,gender
didnt discuss wealth discuss islam barbar,cyberbullying,religion
rememb everi donkey beleiv kathi jackson bullshit hate gillard bunch sexist prick auspol,cyberbullying,gender
dont find attract dude call femal bitch hoe,cyberbullying,gender
ultro thanalan shout could use gming remov gay basher kid tell rape joke dont pay endur,cyberbullying,gender
isi terrorist hold quran hand show one terrorist hold manusmr,cyberbullying,religion
moham slave trader caravan robber murder behead rapist sexist bigot liar pedophil like isi,cyberbullying,religion
covid patient spit healthi peopl terroristparticular islam jihad fuck intellectu jihadi human spit,cyberbullying,religion
gay marriag unequ rape joke,cyberbullying,gender
guy piec advic rape joke never funni dont know much women gay man tell certainti,cyberbullying,gender
hell twist turn mani thing made muslim dumb idiot,cyberbullying,religion
billion muslim idiot size popul contribut virtual noth,cyberbullying,religion
poor kid cop breath without face mask cop could covid hes given kid swear mani cop america high school reject bulli school amp couldnt amount anyth els,cyberbullying,age
bro swear person went school would bulli shit lol,cyberbullying,age
like childhood bulli hard there noth,cyberbullying,age
freedom speech insult someon hate fill religion exclud,cyberbullying,religion
joke dude last night bunch gay frog tri rape damn,cyberbullying,gender
disagre richard pryor told rape joke rape neither gay woman go tell man cant joke rape gender sexual orient,cyberbullying,gender
bulli asian smart quiet tri friend one bulli high school bulli girl boyfriend like idea first place,cyberbullying,age
sorri someon emo high school post like someth bad happen girl bulli high school shit make cring your grown ass adult your still hold onto high school trauma couldnt,cyberbullying,age
filthi palestinian attack murder jewish children school past fuck palestinian,cyberbullying,religion
would ever pull nigger nigger disgust word black peopl hand usual beaut,cyberbullying,ethnicity
watch audienc revolt margaret cho joke rape white gay peopl bb,cyberbullying,gender
im muslim cant tell noth holi citi say idiot lynch human,cyberbullying,religion
level denial way past point ration may iran money taliban love kenyan muslim releas buttbuddi cost us american live bad wasnt particular use idiot san deigo,cyberbullying,religion
rt islam domin crime prison amp welfar system amp nation secur still import amag,cyberbullying,religion
idiot muslim men sex without marriag drink get tattoo drug pork draw line lmaoo funni,cyberbullying,religion
shameless peopl sanction condemn person pm talk delinqu idiot care call muslim billion muslim peac lover world would kashmir indian occup,cyberbullying,religion
muslim im also black pls realiz one say muslim concentr camp arent import stop make us look like idiot understand your feel isnt right,cyberbullying,religion
dream back junior school peopl bulli older still bulli even grew stuff worst part thought whole thing real actual happen work feel safe head,cyberbullying,age
could never respect black man say conduct self like nigger ever dumb fuck tri,cyberbullying,ethnicity
high school album dont bulli much still got one year high school left that neither tag anyon anyon wouldv tag alreadi done,cyberbullying,age
exact liter cant never progress peopl allow isnt high school bulli peopl embarra call name month liter show petti person,cyberbullying,age
school year im bulli anyon got much troubl last year,cyberbullying,other_cyberbullying
rape joke oh fuck god yeah get lgbt hold cis gay men thank im allerg,cyberbullying,gender
slight incorrect countri attack idiot delhi happen muslim highlight terrorist separatist happen muslim side idiot thing common seem religion,cyberbullying,religion
nigger mean ignor unknow ignor come color dumb fuck amp look like ignor fuck,cyberbullying,ethnicity
never joke rape self harm suicid bulli gay mental ill around ill beat,cyberbullying,gender
tell mrjihadihow defend islam terror londonspainmumbai train bomb new yorkparisdenmarkpeshawardhakasri lankarussia attackal attack shout alla hu akbari allah pleas kill innoc,cyberbullying,religion
said person like view mcintosh feminazi like say dont like word isnt misogynist,cyberbullying,gender
women use rape gay men straight men joke dont realiz your still make joke rape time give reason men dont speak rape women annoy tf yall annoy,cyberbullying,gender
video queerpoc im gonna apolog rape joke im gonna apolog gay joke,cyberbullying,gender
rt call sexist hate hear femal rapper switch song hesit whatsoev,cyberbullying,gender
virus spread kill citizen came europ close china muslim countri let almost million peopl enter us europ limit incompet caus extra death your idiot,cyberbullying,religion
critic if but harm muslim open condemn misde hindus uncondit high time educ like zaffar bhai start condemn idiot without prefix suffix appreci,cyberbullying,religion
girl bulli high school stop post world mental heath day lol,cyberbullying,age
seem tho lmaooo mad bro fuck dumb nigger obama,cyberbullying,ethnicity
rt congratul your idiot,cyberbullying,other_cyberbullying
ur one tweet first,cyberbullying,ethnicity
see exact need fight anti semit like noth israel way beauti place jew muslim live side side left wing white blm idiot immedi say israel jew mention,cyberbullying,religion
fuck fat ass whatev yo race rt fuck obama dumb ass nigger,cyberbullying,ethnicity
western didnt subscrib nazi ideolog muslim subscrib religion hater murder bigotri,cyberbullying,religion
movi explict way one antifascist doesnt get rid homophob implic tie rape tortur children gay man dont like like person isnt excus make bigot joke harm,cyberbullying,gender
fuck dumb nigger cunt,cyberbullying,ethnicity
men never date women want sex right presumpt sexist say least men sex zero element rape wors assum stereotyp black gay white straight asinin back crappi,cyberbullying,gender
elementari school bulli,cyberbullying,age
walk past mum day say fuck dumb nigger funni thing didnt realli care,cyberbullying,ethnicity
straightplus one girl bulli high school,cyberbullying,age
girl pretend like anim male attent take weird got bulli relentless boy middl high school like anim plan clear didnt work,cyberbullying,age
rt articl like site behind blameonenotal truli voic women,cyberbullying,other_cyberbullying
dri pussi bitch alway blame condom,cyberbullying,gender
gay joke rape joke,cyberbullying,gender
rt questionsformen prove man sexist without tri women cant even creat hashtag explicit,cyberbullying,gender
muslimsjihadisterrorist cant hv politicalreligiouseducationalrightsgtthey invaderstraitorspredatorsbarbarian conspir ghazwaehind darulharb jihad hindushindutvahindusthanhuman hindusthanimuslim acceptrespectprotect sanatan sanskriti,cyberbullying,religion
barr kid everi bulli pick school decid ingrati natur,cyberbullying,age
rt islam religion hate violenc deceit,cyberbullying,religion
rt fuck obama dumb ass nigger deep insid wanna black thts ur tayyoung kno didnt mean,cyberbullying,ethnicity
stupid got,cyberbullying,gender
survivorprivileg see friend subject homophobia gay joke file report polic rape,cyberbullying,gender
mr idiot minist incid occur place malappuram incid place palakkad killer belong hindu communiti messag communal stori peopl man eater also preach religi hatr toward dalit muslim,cyberbullying,religion
littl halfway world worst parent stori read kid start school mum teach mum excit kid say pretend relat break mum heart get bulli teachermum stop bulli yeah terribl parent,cyberbullying,age
social media like continu high school bulli never got fill dole cruelti least could go back teen could destroy go jail,cyberbullying,age
high believ oscar someth black peopl poc general black creator barley anyth past coupl year woman white best actress liter make sens,cyberbullying,ethnicity
mayb blm pantifa shouldnt trash citi one would need protect properti funni ur stori ignor first day riot,cyberbullying,ethnicity
listen man dont prove shit im say idiot demand lbj speak everi social issu vocal one muslim china isnt lebron fight fight champion lbj fight world lol,cyberbullying,religion
alreadi got bulli shove locker throughout high school girl laugh cancer pleas stop,cyberbullying,age
rt im sexist there noth aggrav femal tri talk sport im like get tf,cyberbullying,gender
imagin call white your white imagin call negro nigger monkey centuri black,cyberbullying,ethnicity
southern christian woman cajun backgrund appar care feel mob right amaz,cyberbullying,religion
obama staff manag account tweet presid sign bo hahaha bo fuck dumb nigger,cyberbullying,ethnicity
realli loyal dog pompeio search dictionari long time find uygur nation think xinjiang peopl muslim china even ethnic minor rare religiousidiot indiand cast system first,cyberbullying,religion
lethabo probabl loud girl high school bulli newcom rhoj rhojreunion,cyberbullying,age
racist select ur white cloth wash black color onesstop racism wash gether nutin doeth thou,cyberbullying,ethnicity
fuck obama dumb ass niggerlolyal real madd huh,cyberbullying,ethnicity
rt year ago silicon valley lawyer ed zimmerman made pledg attend allmal tech event,cyberbullying,gender
fault ur one repli first,cyberbullying,ethnicity
im feminazi need sexism outrag enough invad someth,cyberbullying,gender
raven isnt dont make rape joke doesnt make gay lmao,cyberbullying,gender
dayum white plp gotta haten us balck plp shit realli dumb wat bc nigger man fuckin care grow fuck,cyberbullying,ethnicity
period periodt girl chant say repeat shout girl locker room carri remak horror movi sit floor shower bulli poor white girl cri upset humili high school yell shower gym class gym bathroom restroom,cyberbullying,age
realiz one girl bulli high school age even older colleg degre anyth life damn feel good,cyberbullying,age
find disgust strang black person call anoth black person nigger degrad,cyberbullying,ethnicity
notic evangel amp mormon fight right continu discrimin lgtb peopl biggest worri tran woman shit christian woman,cyberbullying,religion
african decent dont give fuck chang name steve good credit discredit black cultur still nigger countri like fuck cut bullshit look dumb hell still dont give fuck,cyberbullying,ethnicity
know els real islam terror real radic islam real ghazwaehind real kill sadhus real palgharmoblynch,cyberbullying,religion
didnt ur first one final beat nandu,cyberbullying,ethnicity
year lmaoooooo rt fuck obama dumb ass niggeryour suicid watch,cyberbullying,ethnicity
black like call birth name accept call negro variat word nr classifi caucasian white refer black african american,cyberbullying,ethnicity
mr ajit brawl tweeter bulli school boy,cyberbullying,age
isi osamabinladen hizbul ampal terrorist read follow qurantrillion proof accept allah order jihad terrioustattack voilenc world belong islam quran hadis world govern ban itfollow china kill muslim islam agent silent,cyberbullying,religion
fuck dumb ass nigger decid follow welp,cyberbullying,ethnicity
mendndldld biggest middl school bulli besti,cyberbullying,age
problem call sexist cant enjoy game much woman announc call,cyberbullying,gender
arnt guy post rape joke rt love zimbabw rt gay arrest zim parti,cyberbullying,gender
thank that im get muslim act like idiot fight enemi slowli win,cyberbullying,religion
realli ive alway pop mine let get might idea ask well feather new girl like high rank less like bulli girl,cyberbullying,age
ur opinion one gna attack ill tbe first onz bite thekr ankl unless zeina ly zeina drag,cyberbullying,ethnicity
type girl bulli weird kid high school,cyberbullying,age
name shame call congressi muslim pakistani let tell dont support polit leaderparti narendra modi rahul gandhi incompet idiot yeah there repli strong evid support claim,cyberbullying,religion
fuck douch magnet cum dumpster stupid failur ass wipe scum bag dick cunt fag bitch retard nigger shit hole dumb fuck,cyberbullying,ethnicity
fuck dumb bitch whore faggot cock ass dickwad shit douchebag nigger motherfuck titti,cyberbullying,ethnicity
new year dumb ass nigger rt houston vs seattl sb go bore fuck,cyberbullying,ethnicity
fuck obama dumb ass nigger woah der hoe cant mad bitch straight,cyberbullying,ethnicity
dad said fuck didnt say bye said peac nigger mad dumb shit,cyberbullying,ethnicity
believ bless heap upon american negro night ago man would call america white man unit nation diplomat ambassador companion king gave hotel suit bed never would even,cyberbullying,ethnicity
elementari bulli wear glass girl um also wore glass middl sweati pit high school flat chest,cyberbullying,age
cortez hate crime men anti male feminist misandri gold digger cortez act like cri babi school yard blame bulli boy lie promot amp motiv bias boythi ia attack boy,cyberbullying,age
paulin hanson want kick asian muslim deni coral bleach go south end gbr problem accept donat us gun lobbi weaken aus gun law forc qld gov open border pandem give idiot platform,cyberbullying,religion
peopl fuck serious dont ask locat hotel comment pic made celeb want stalk,cyberbullying,other_cyberbullying
opinion joke ok noth offlimit joke point hypocrisi sorryitsaboy,cyberbullying,gender
bulli middl school style see shit ur forehead,cyberbullying,age
exact idiot cant understand basic languag muslim muslim exclusionist reject anybodi hate pain deal hear lgbt communiti cos got hella fuckin stori,cyberbullying,religion
franki peach help rubi new girl school find courag stand bulli pancak girl inspir stori show small act kind make big differ someon life kidlit,cyberbullying,age
what crazi amount girl made fun bulli high school time play victim right apolog,cyberbullying,age
imagin one day ur chill hear news peopl hyter agress manner attack everyon would quickest first weapon pick would,cyberbullying,ethnicity
homophob rape joke rt joke look two dude sex your gay,cyberbullying,gender
