text,binary_label,multiclass_label
problem non vegetarian problem select target particular religion becom spine less muslim religion involv idiot hypocrit organis,cyberbullying,religion
comedi muslim see idiot uneduc women support islam terrorist money,cyberbullying,religion
morgan stfu nigger racist nd dumb fuck bitch,cyberbullying,ethnicity
kevin hart get hard twohour joke gay rape hilari read,cyberbullying,gender
yearold cant even get licens im sexist guy teacher far better teacher girl,cyberbullying,gender
muslim want destroy israel racist land tini,cyberbullying,religion
sinc feminist sorryitsaboy amp everydaysex love joke thought theyd like oneright,cyberbullying,gender
bill tweet sound like school age bulli come man critic someon look call media profession,cyberbullying,age
lmfao white person done call obama magic negro,cyberbullying,ethnicity
that rich come racist like tell us congresswomen go back countri color racism racistpresid,cyberbullying,ethnicity
aj line manifest gay joke amp joke prison rape,cyberbullying,gender
dont know ngl would let bulli school,cyberbullying,age
own shop cater most black hair care anger call blacki niggerwhewww chileee thiev obvious thiev racial slur shop cater black peopl disgust,cyberbullying,ethnicity
unfollow spree cus wanna skinni ratio sorri accident follow jdg stan ur one first one go,cyberbullying,ethnicity
fuck take away communic dumb fuck nigger neck pussi,cyberbullying,ethnicity
joke dont make pakistan peac countri peopl rule pakistan pakistani armi terrorist group dont know creat alkaydataliban mani type group kill human world name fake jihadhuman ka matlab bhi pata hai,cyberbullying,religion
america best remain secular respect religion islam exampl terrorist take passag context justifi jihad amp crime human session quot biblic passag use justifi slaveri justifi separ kidspar tragic,cyberbullying,religion
everi girl bulli high school middl school either becom nurs physic therapist lmao,cyberbullying,age
guy realiz talk femicid general bad mayb even wors women need stop blameonenotal,cyberbullying,other_cyberbullying
negro translat black spanish english broken ive call white person work africa time dont see issu call whatev easiest goe gk leed,cyberbullying,ethnicity
new projector reoccur fake tweet level bella girl lost weight guy high school bulli,cyberbullying,age
racist uneduc deplor dumb educ nigger kike dike faggot bitch cuck etc get fuck outta,cyberbullying,ethnicity
rape joke gay joke innernet meme errywher,cyberbullying,gender
tweet year ago young man didnt know better defens wont work apolog comment gay amp lesbian allianc defam found offens mani tweet pedophiliarap isnt joke,cyberbullying,gender
call idiot think muslim arab,cyberbullying,religion
funni thing im dominican dumb ignor fuck rt nigger alway fuck jajaja,cyberbullying,ethnicity
question support trump devot pro life christian consid consequ support radic left even power push abort demand vote trump vote life,cyberbullying,religion
systemat racism real america dont white peopl power posit say negro color andor nigger polici doesnt mean racism abolish,cyberbullying,ethnicity
like degener bulli school theyr town near us glorywhat kind sociopath wouldnt enjoy tear gass peac protestor like senior citizen nurs mom vet lockthemup,cyberbullying,age
wtf told handl sexual harass situat christian woman right defend gave power man lose fuck job femal status made blood boil,cyberbullying,religion
rude racist disguis cant spell bulli nobodi want twitter leav,cyberbullying,ethnicity
everi nurs girl bulli high school except ann perkin,cyberbullying,age
im curious mindset might differ new femal founder vs dude,cyberbullying,other_cyberbullying
lmao someon chant jai shree ram threaten bet rss worker threaten ladi hope convert would happi join gokhl first stop muslim offer prayer mumbai road idiot pleas,cyberbullying,religion
religion murder hate pedophil core room reform,cyberbullying,religion
wo whole thread,cyberbullying,other_cyberbullying
im middl age white guy grew south went school most black communiti ive never call someon negro slight opinion,cyberbullying,ethnicity
nigga flirt like middl school bulli,cyberbullying,age
theyv abl idiot like dont vote midterm go vote nazi babi cage hous discrimin muslim ban trump republican great night jc,cyberbullying,religion
happen give uneduc high school bulli footbal player brain injuri month train gun badg take train cut hair,cyberbullying,age
thank foxfir lost classmat high school suicid horribl bulli middl school teach girl come asid kid mistreat right thing know tell nerd win kind,cyberbullying,age
curious girl onlyfan yall ever think much kid might get bulli back high school rememb foo use use mom pictur fb roast imagin,cyberbullying,age
total get bulli mani girl high school bc land hot new guy quiet band geek yet chose long ago someth also wont forget either,cyberbullying,age
stop idiot divid tarnish imag india name religion india hindu muslim countri indian peopl differ cast creed see countri becam religion worst everi social develop indic,cyberbullying,religion
um hey truth black man compani past incid racism dont say ur go pick anyth coon,cyberbullying,ethnicity
obvious super dumb would never fuck black nigger ugli aid,cyberbullying,ethnicity
fuck everi dumb ass bitch nigger doesnt like adel yuh fuckin stupidddddddddd thatisal,cyberbullying,ethnicity
rt bitch twin bed talk hate sleep alon bitch choic,cyberbullying,gender
toronto fuck joke racism exist idiot gave subway shorti follow say word tell muslim speak english apart problem guy enabl shes bad nice ass fuck problemat,cyberbullying,religion
realli muslim understand want abl use name racism shut us,cyberbullying,religion
weve proven dumb blond pretti face true mkr,cyberbullying,gender
accor alicespr racism aborigin noth surpris french racist color ppl insid countri think better coloni imperi behavior hard shake,cyberbullying,ethnicity
whole think piec gay joke ive receiv end real weird shit speak rape sens bad relationship say feel weird dont mind speak topic caveat im will talk,cyberbullying,gender
bear fals wit good look nice christian woman like need get right lord sarah repent end time draw nigh,cyberbullying,religion
idiot muslim fascist dont realli know ayasofya saint turkishchristian muslimat least call otherwis ayasofyaeveri bodi laugh youth end approach lira collaps,cyberbullying,religion
ok pill idea neutral posit idea fantasi misinterpret came later fatsham slutsham statutori rape fals sexual assault accus gay racist classist joke general bitch crazi shit begin,cyberbullying,gender
act iranian divin dark skin golden negro hebrew peopl god white devil american call islam terrorist god mexican peopl white devil america call rapist terrorist crimin south border america home,cyberbullying,ethnicity
base past like cop murder black man three partner sit watch georg floyd could accomplish anyth littl bit misfortun,cyberbullying,ethnicity
come blaze idiot liber,cyberbullying,other_cyberbullying
sheesh river littl bulli poor fray felinedrama,cyberbullying,other_cyberbullying
awww dont make gay rape joke mo swear ever see real life im punch black blue,cyberbullying,gender
awar peopl still act like middl school bulli age,cyberbullying,age
could bulli high school meomg,cyberbullying,age
idiot go nowher cant run shoot nation foot isra near india kashmir wait shoot foot muslim head,cyberbullying,religion
aww look forward ash camilla but head promo girl drama wouldv great mkr,cyberbullying,gender
got sent princip offic elementari school fight context mattersi accur got middl fight tri stop school bulli pick anoth student,cyberbullying,age
kid school bulli cream pant,cyberbullying,age
exampl radic islam terror check ur word post still live peac india itna problem hota tum aj bhuk bhi nahi pati aukat baat kiya kare logo ko chutiya na bana,cyberbullying,religion
bori johnson known racist compar muslim women mailbox uk alreadi slight less spici version trump lol also tri live us healthcar gun control tell want bankrupt idiot run countri,cyberbullying,religion
say th main padt hai like pok jo jihad ke liy terrorist camp main train hote hai yes suffer past pakistan propag hate use islam pakistan human prevail india world,cyberbullying,religion
share concern kid bulli couldnt post cruel thing entir school bulli everywher there kind work extra hard foster kind children,cyberbullying,age
fuck dumb nigger nice knick clipper thunder best team,cyberbullying,ethnicity
sarah oc bulli sinc older sister movi start high school lot kid most girl bulli fanfic stori make also getsi say abus blu jester fanfic joker,cyberbullying,age
compar feminist holocaust im proud say im fuck feminazi,cyberbullying,other_cyberbullying
barrhear barr attorney general hes trump asslick give fuckal constitut barr notori school bulli grew shine shoe bigger bulli one purpos reelect trump protect trumpcrimesynd,cyberbullying,age
dont follow bbc forc agre provis would respons one way anoth agre fund whole thing like school bulli tell kid agre stick head toilet,cyberbullying,age
yooo happen tweet well anyway follow girl high school block caus shes conserv say thank work would definit cyber bulli ass first trump retweet,cyberbullying,age
mean countri folk want noth muslim blm movement fascist antifa idiot riot mean let act like spoil brat throw temper tantrum get way agre store antifa blm keep eat blue citi,cyberbullying,religion
oh see neil respond one gamergat that couldnt tell context,cyberbullying,other_cyberbullying
doesnt care obv hes guy call wife daughter fuck bitch think hed care didnt mind go younger femal aoc someth right shes start get level hate ive seen hillari good compani,cyberbullying,gender
muslim land ever live anyth tyrant dummi,cyberbullying,religion
true look like one bulli high school rape girl pass move colleg bulli assault teammat join polic forc kill peopl that look like,cyberbullying,age
hey luca bulli school bright differ bulli didnt get far life weak stupid inadequ unhappi way rememb rememb dad love look,cyberbullying,age
im thingi bulli middl school beingweirdand especi th grade big crush girl pretti promiscuoussexu activ thth grade high schoolnow im approach net worth age,cyberbullying,age
stop idiot amp tri obfusc issu prove mani time other fave fact slave experi grow africa know mani north african muslim heavi legaci black slaveri read book,cyberbullying,religion
that damn joke soundtrack product daddi cant rape us redon version wolverin gay sinc marvel go let use name wolverin,cyberbullying,gender
rape isnt funni know crazi old men joke pretti women rape afraid gay men lust gay man tri sex know make women feel,cyberbullying,gender
im say blow mind rd year high school still think okay bulli underclassmen someth happen past learn mistak came,cyberbullying,age
ok dumb rape joke racist joke whatev okay soon call someth gay friend get defens,cyberbullying,gender
fuck girl went high school gay like tf yall get bulli lil fg,cyberbullying,age
rememb time joke georg takei go rape someon becam gay icon whatev,cyberbullying,gender
rt mom daughter ask would call slut sexretari feminazi rush amp pay,cyberbullying,other_cyberbullying
tiktok realli space feel safe watch queer peopl see cool christian woman support lgbt right say life threaten irl shes support rememb your closet forev,cyberbullying,religion
serious guy never learn peopl movi industri purpos dont care hindus idiot still go around ask reason support black livesmuslim livesbrown live etc need money amp ppl give,cyberbullying,religion
unbeliev way journalist fall make excus barbar islam one read quran,cyberbullying,religion
femal basic like soft way call us bitch hoe impli degrad femal biolog term femal cat femal eleph refer femal human would call woman lot men turn call women femal,cyberbullying,gender
mani idea littl time even full time im talk peopl,cyberbullying,other_cyberbullying
modi cheap bigotri take babri masjid demolish illeg kill thousand muslim pm heinous judg like finger puppet bhakht disgrac idiot,cyberbullying,religion
happen yesterday germani polic raid shia mosqu boot dog disrespect quran dua book pleas master us israhel hezbollah fight isi terrorist group syria defend minor,cyberbullying,religion
honest look like bunch littl pussi play armi dressup guy wouldnt last minut actual train equip fight forc even bulli knew high school didnt beat girl total unarm girl tri avoid fight,cyberbullying,age
made rape joke amp said lesbian choos gay bunch shit,cyberbullying,gender
shout middl school bulli,cyberbullying,age
say nigger call drake faggot think im hood rat cant even bag ive got white cunt got white faggot citi cover steal money dumb fuck love dumb fuck retard think shes doctor remark nq,cyberbullying,ethnicity
one muslim countri secular mr owaisi may liter less idiot hindus natur secular gave refug paigambar famili muslim life gave land st mosqu outsid arabia murkh,cyberbullying,religion
mlk anoth irrelev nigger fuck dumb racist ignor ass bitch,cyberbullying,ethnicity
even muslim dont want live dictatorship everybodi live isi land hate,cyberbullying,religion
presid make gay rape joke mock jordan victim wont make page,cyberbullying,gender
warmest da fuck funni bitch ass said man everyth short nigger bullshit pull save tweet dumb ass resign,cyberbullying,ethnicity
truli hope girl bulli high school littl girl never experi get bulli,cyberbullying,age
listen care awar extremist islamiterror isi terror terrorist pakistani oppos muslim bro amp sister threat global peac quran thursdaymotiv thursdaymorn,cyberbullying,religion
got bulli acn draw breast girl beat gym class year later felt bad bought gift everi week high school,cyberbullying,age
watch documentari feminismsexismmisogyni wonder gay male comedian rape joke young men,cyberbullying,gender
child haunt wit peopl drop death omar giggl like terrorist empath devoid human omar like nazi laugh kill jewish victim nazirad jihad connect,cyberbullying,religion
deacon childhood church told mother front kid like would end get put prison ten fight back bulli noth stop also princip school,cyberbullying,age
dont fake melodrama like pandit kill islam terror tweet video attack union govern sinc video ajay ask secur dont bloodi drama hereur idealog ur parti done kashmir,cyberbullying,religion
fuck would ask follow back fuck unfollow dumb cunt ass nigger bitch,cyberbullying,ethnicity
feel girl got bulli high school rumor fuck cucumb someth adult know phallic veggi stay look better exe,cyberbullying,age
miyano known school bulli hes also apart yakuza japanes gang known ruthless mad want reveng,cyberbullying,age
namast mr trump absolut amaz vip great scholar frank speaker listen speech speak islam terror viruss chines virus proud sir,cyberbullying,religion
fuck obama dumb ass nigger oh black peopl racist one elect ok see,cyberbullying,ethnicity
born yrs incidentampmillenni pick age im touchso much racism likethos daysdo honest believ still remain bathroomsampwat fountain segreg mani town forgot day noth like,cyberbullying,ethnicity
hahahaha failur one learn process fail isnt end point roadsometim failur teach better person failur answer reason couldnt see back lead miss step first place fail see ur weak,cyberbullying,ethnicity
realli weak ass punk idiot got bulli school didnt ball stand bulli go show world tough attack starbuck laugh,cyberbullying,age
trump hold bibl like isi hold quran terrorist use holi book polit agenda fuck disgust,cyberbullying,religion
stori bulli high school classmat,cyberbullying,age
school popular kid bulli half least,cyberbullying,age
hate pregnant femal mad ima call bitch drop babi though,cyberbullying,gender
watch middl school bulli tri convinc victim hes gonna nice nowwhil toss dirt clod one hand,cyberbullying,age
mr trump ive never ask help pleas read truth tweet dr francin gayl call talk frame evid lie like black christian woman love peopl like right thing help pray,cyberbullying,religion
matter right christian woman frighten countri,cyberbullying,religion
saw girl bulli high school twerk facebook live good lmao,cyberbullying,age
would awesom could fuck bess dumb ape nigger gobrown,cyberbullying,ethnicity
think earlier girl bulli high school wish would told bite know insecur bitch time made feel horribl,cyberbullying,age
rt im sexist girl drive truck weird wanna look dyke mean,cyberbullying,gender
rt bitch talk bad bad,cyberbullying,other_cyberbullying
attitud schaaron ass score test hair law field mine law field hate hair wrote complaint stole right ba ha ha ha never call kid christian woman guilt,cyberbullying,religion
nigger make rap video dress american label live africa dumb fuck,cyberbullying,ethnicity
dont know peopl problem someon judg without know caus realli hard understand your brave enough handl idiot dont let effect arrog your respons muslim citizen,cyberbullying,religion
rt hate women sport analyst notsexist theyrejustannoy,cyberbullying,gender
becom rafidah curs sahaba abus prophet wive abus khulfa claim anoth version quran creat isi kill sunni middl east expand thru terrorist militia gather war ravag countri poor popul afghani pakistan yemen happi,cyberbullying,religion
yes white femin ignor privileg white women given woc,cyberbullying,other_cyberbullying
yall want anymor white ass crazi drama show hulu call taken birth white doctor sold babi back door clinic door small town negro sight good old hot aryan mess,cyberbullying,ethnicity
dont deal issu first peopl die kaduna bc polit mind want peopl keep die focus taraba statessomeon father shot head southern kadunawith ur polit mindset jus pray isnt one day,cyberbullying,ethnicity
girl bulli high school want join pyramid scheme never felt popular,cyberbullying,age
better day dir kwok cheung tsang chines drama crime bulli high school student smalltim crimin becom prime suspect murder teenag girl turn student nemesi state gaokao exam,cyberbullying,age
idiot zionism determin jew recov small fraction land stolen muslim,cyberbullying,religion
never said dont think im femal said make uncomfort men call women femal feel dehuman your wrong im absolut bitch peopl dont notic,cyberbullying,gender
that sick generalis bro like say isi repres muslim doesnt idiot alway hate laugh other paineven theyr indian cant hate nation action billion,cyberbullying,religion
stop make rapesexu assault gay joke funni disgust,cyberbullying,gender
rt exact kitti feminazi garbag spew stoprush,cyberbullying,other_cyberbullying
scumbag muslim children use propaganda,cyberbullying,religion
vote og first one ur mom hoe,cyberbullying,ethnicity
sad see sasha gone went way bad didnt get bite ass hole negan,cyberbullying,gender
neuron fire im sexist racist im bigot there differ,cyberbullying,gender
grown man leav street alon child realiz dont street aint got love em grown man that street nie bulli school mad,cyberbullying,age
palestin belong muslim idiot,cyberbullying,religion
bro zero hate kashmiri guy action idiot blame whole india that right muslim friend even kashmiri friend talk nice want proper debat im slang,cyberbullying,religion
bulli bunch girl high school move happen move make life work bulli other hate demon men guess us take differ path,cyberbullying,age
nope one whit im sexist women sport aw,cyberbullying,gender
im asham im half white dont want part disgust judg race like realli chang nigger mean black ppl sick,cyberbullying,ethnicity
propagandist idiot believ apartheid india ih berni co spread islamistcommunist bs propaganda india dare eras death injuri loss hindus delhi riot call sole antimuslim,cyberbullying,religion
dear muslim brother write statement jesus christ dont forget prophet disrespect mistak idiot mean disrespect prophet religion,cyberbullying,religion
joke domest violenc disabl rape gay peopl labour actual select jim davidson,cyberbullying,gender
react call us dumb nigger im hurt rt im mad call dont give fuck none nigga,cyberbullying,ethnicity
brotherno religion teach disrespect god instead hinduism doesnt even bind anyon god unlik islam let tell doesnt matter shit written one vers throughout quran follow thousand terroristsisi etc,cyberbullying,religion
dear freshman boy rape joke call someon red funni inanim object gay amp yes know im hot bye,cyberbullying,gender
mad rt rt fuck obama dumb ass nigger,cyberbullying,ethnicity
criterion islam antiislam terrorist group like isi western media offer yes that religion peac search real islam read quran time say find violent content,cyberbullying,religion
nigger busi give mix signal via tumblr pictur fuck tumblr dumb af,cyberbullying,ethnicity
rt im say women cant great leader weak fact incred decept,cyberbullying,gender
sir salut help us fight islam terror support uncondit,cyberbullying,religion
nice one huge fan ur sitcom never comedi kinda girl sister introduc love first great kofo side kick,cyberbullying,ethnicity
tf black nigger fuck fuck go head nigga act ignant dumb fuck,cyberbullying,ethnicity
roblox hs roleplay server perfect environ describ straight vs gay warningear rape joke joke fun funni humor samantasanta,cyberbullying,gender
shoutout girl bulli middl high school,cyberbullying,age
associ monster high bratz doll bad feel thing popular girl bulli elementari school,cyberbullying,age
time middl school high school breez peopl tri bulli toss insult didnt carewhich piss,cyberbullying,age
put cosbi next long hes funni enough get men laugh rape joke hed golden,cyberbullying,gender
avi stupid fuck dumb nigger lmfao,cyberbullying,ethnicity
fuck ill take follow fuck selffuck idiot nigger dumb cant even give shit without hate,cyberbullying,ethnicity
girl bulli high school call lo,cyberbullying,age
consid suicid find racist gay rape joke funni tbh,cyberbullying,gender
whaat turkey fight uyghur muslim turkey cant fight huge countri like china muslim idiot,cyberbullying,religion
show org report detail muslim terrorist screed sympathet tone tell indoctrin fellow radic idiot said screed mitig happen amplifi voic,cyberbullying,religion
live nyc life ive known mani offic nypd decent human be troglodyt bulli toss coin high school cop crimin problem minor good cop alway cover bad one,cyberbullying,age
sound like one mean girl bulli girl back junior high pretend digniti,cyberbullying,age
radic muslim today nazi shall defeat judeochristian west amp countri support freedom must strong resolv radic aggress countri iran,cyberbullying,religion
rt sexist womem sport aint tast tbh especi see um ufc leav go nurs hair dre,cyberbullying,gender
natur citizen muslim think idiot hope find mean life move forward without hate,cyberbullying,religion
ok dumb guy wore black face year ago back peopl thought ok say dont nigger lip joint anoth year ago fuck let go desecr grave al jolson time,cyberbullying,ethnicity
rt gg doesnt get either even harass jst insist realb,cyberbullying,other_cyberbullying
fake account one cell idiot muslim name request pleas report account dont believ account like,cyberbullying,religion
tell what militari like oh like deploy powerpoint gay rape joke,cyberbullying,gender
went thing googl ur tf map first one show,cyberbullying,ethnicity
word racist bc white peopl call slave nigger sinc negro black spanish skin darker term made identifi us belittl us bc skin darker that shouldnt use histori mean word bad,cyberbullying,ethnicity
rt ive cheer draka everi time xpac swear,cyberbullying,other_cyberbullying
jaoamin alway look untrust got mean girl bulli high school look,cyberbullying,age
didnt anyth amp total agre never happen million amp million black peopl way success still dwell past white amp black need let go,cyberbullying,ethnicity
fool also believ fake news media wow never muslim idiot includ north korea omit largest countri muslim major popul possibl someon run presid would believ lie mayb start dnc,cyberbullying,religion
girl bulli junior high wear doc one wear bc theyr tbh want financi compens trauma thx,cyberbullying,age
tell muslim innocentquran also tell jihadwhich muslim radic islamisi alkayda taliban hizbulal muslim accord un data muslim terroristand tell must innoc,cyberbullying,religion
dumb ugli nigger name wayn posit trash fuck red white pictwittercomscfyqgvq,cyberbullying,ethnicity
girl bulli high school husband got babi sitter pregnant yep karma,cyberbullying,age
man spank kid pleas teach lesson earli caus kid come bad tri bulli mine hes gonna sleep boy dont want come school take time day kid teach kid lesson fail teach,cyberbullying,age
locat need ass beat rt fuck obama dumb ass nigger,cyberbullying,ethnicity
thing piss rape joke word gay use insult peopl use racial slur,cyberbullying,gender
better support network amp feel like construct thing done abus would fix think,cyberbullying,other_cyberbullying
rt dont ed im stupid girl eat lot wonder shes fuck fat,cyberbullying,gender
us flag burn black live matter brooklyn protestw past weekendi dont see anyth done,cyberbullying,ethnicity
feel hitler right hand man love christian woman callmoth feel,cyberbullying,religion
man fuck yall nigger ill take littl dumb ass sleep,cyberbullying,ethnicity
nobodi said muslim major district see religion malappuram idiot thing happen bring particular religion clear hidden agenda,cyberbullying,religion
smh fuck obama dumb ass nigger,cyberbullying,ethnicity
dont support islam terror anit muslin anti minor patriot agianst islam terrori terrorist khalidsaifi,cyberbullying,religion
order protect human elimin jihad terror becom import jihadi die terrorist die,cyberbullying,religion
hillari friend support funder treat women slave kill gay abus women rape want know sexist look,cyberbullying,gender
weird flashback today middl school met one bulli yesterday liter cri whole hour hate,cyberbullying,age
smh rt fuck obama dumb ass nigger,cyberbullying,ethnicity
say fuck black nigger white cracka spic slav racial dumb fuck remark grow thatsanono,cyberbullying,ethnicity
